{
  "entry_id": "33333333-3333-4333-8333-333333333333",
  "title": "Q1 2026 季度汇报关键业绩",
  "summary": "Q1 营收达成率 108%，同比增长 23%。新增企业客户 14 家，流失 3 家。AI 产品线贡献占比从 28% 提升至 41%，成为第一大营收支柱。海外市场初步开拓，东南亚 3 个 POC 客户进入商务谈判阶段。",
  "tags": ["季度汇报", "营收", "AI产品线", "海外市场"],
  "related_files": [
    "11111111-1111-4111-8111-111111111111"
  ],
  "created_at": "2026-07-09T09:35:00+08:00",
  "confidence": 0.92
}